{
  "materialization_request_sha256": "2a2eb38164437ff3bc8cb69058ce5cc3c4a273bb047c6feafa89ef48116159bf",
  "original_source_plan_unchanged": true,
  "output_shape": {
    "height": 256,
    "width": 512
  },
  "pack_id": "usda-cdl-imageserver",
  "requested_asset_roles": [
    "classification"
  ],
  "schema_version": "fasterraster.source-materialization-request/v1",
  "source_plan_sha256": "3ec12ace6c6e885315601c868f1372a1218fb74c5a88049a5a312e6b92b41712",
  "spatial_request": {
    "bbox": [
      -77.1,
      38.8,
      -76.9,
      39.0
    ],
    "bbox_crs": "EPSG:4326",
    "mode": "bbox"
  }
}
